{"predicted_whole_face_unlock_members":[{"assertion_locator":{"assertion_index":1,"exact_text":"Target player draws two cards.","span":{"end":30,"start":0}},"complete_gap_set":["verb_unmapped:p_draw"],"oracle_face_id":"oracle:8f32ceb2-92c2-4dde-bf73-40bb79c3fcef:none","oracle_face_key":{"scryfallOracleId":"8f32ceb2-92c2-4dde-bf73-40bb79c3fcef","side":null},"quarantine_status":"clear","relation_readiness":"not_required","semantic_source_hash":"sha256:9f8861e78eb7aa8ca4fea409bf825d2bd36557244c91e0dbaf3d57283d0b3c98"}],"projection":{"descriptor_hash":"sha256:49b57a167081587b856df898500ec510d3b3395f9405eafc18dea2a82b2f8597","membership_hash":"sha256:225baccc08527ace577f2693b22aa87fb2acbdd31f35a7d75d4225af83ffc3a1"},"root_cause_scope":[{"assertion_locator":{"assertion_index":2,"exact_text":"Target player draws two cards.","span":{"end":143,"start":113}},"complete_gap_set":["keyword_unsupported","verb_unmapped:p_draw"],"oracle_face_id":"oracle:59b869b9-cb48-4152-ad91-52f582e2df5b:none","oracle_face_key":{"scryfallOracleId":"59b869b9-cb48-4152-ad91-52f582e2df5b","side":null},"quarantine_status":"clear","relation_readiness":"not_required","semantic_source_hash":"sha256:1415064e7993d1b8e1ac50fd27cde67696befb7336c6f1b3adecb2475cb7805e"},{"assertion_locator":{"assertion_index":1,"exact_text":"Target player draws two cards.","span":{"end":30,"start":0}},"complete_gap_set":["verb_unmapped:p_draw"],"oracle_face_id":"oracle:8f32ceb2-92c2-4dde-bf73-40bb79c3fcef:none","oracle_face_key":{"scryfallOracleId":"8f32ceb2-92c2-4dde-bf73-40bb79c3fcef","side":null},"quarantine_status":"clear","relation_readiness":"not_required","semantic_source_hash":"sha256:9f8861e78eb7aa8ca4fea409bf825d2bd36557244c91e0dbaf3d57283d0b3c98"}],"schema":"magic.scope/v1","sole_blocker_members":[{"assertion_locator":{"assertion_index":1,"exact_text":"Target player draws two cards.","span":{"end":30,"start":0}},"complete_gap_set":["verb_unmapped:p_draw"],"oracle_face_id":"oracle:8f32ceb2-92c2-4dde-bf73-40bb79c3fcef:none","oracle_face_key":{"scryfallOracleId":"8f32ceb2-92c2-4dde-bf73-40bb79c3fcef","side":null},"quarantine_status":"clear","relation_readiness":"not_required","semantic_source_hash":"sha256:9f8861e78eb7aa8ca4fea409bf825d2bd36557244c91e0dbaf3d57283d0b3c98"}]}
